Historic Centre of the Town of Diamantina,,"Minas Gerais, ?Brazil 18‹40Œ0S 43‹36Œ0W? / ?18.66667‹S 43.60000‹W","Cultural: (ii), (iv)",29 (72),1999,"A well-preserved example of Baroque architecture, this 18th-century colonial town was founded in an inhospitable environment of rocky mountains and became a center of diamond mining in the 18th and 19th centuries.",[39]
Historic Centre of the Town of Goias,,"Goias, ?Brazil 15‹56Œ0S 50‹8Œ0W? / ?15.93333‹S 50.13333‹W","Cultural: (ii), (iv)",40 (99); buffer zone 44 (110),2001,"Founded in 1727 by the bandeirante explorer Bartolomeu Bueno da Silva, Goias has preserved much of its colonial heritage and is an example of a European settlement in the interior of South America.",[40]
Historic Centre of the Town of Olinda,,"Pernambuco, ?Brazil 8‹0Œ48S 34‹50Œ42W? / ?8.01333‹S 34.84500‹W","Cultural: (ii), (iv)","120 (300); buffer zone 920 (2,300)",1982,"Founded in 1537 the town prospered as a centre of sugar-cane production. Following looting by the Dutch in the 17th century, the historic centre dates largely to the 18th century with a harmonious combination of buildings, gardens, churches, convents and chapels.",[41]
Historic City of Sucre,,"Oropeza Province, Chuquisaca Department, ?Bolivia 19‹2Œ35S 65‹15Œ33W? / ?19.04306‹S 65.25917‹W",Cultural: (iv),114 (280),1991,"Founded by the Spanish in 1538, Sucre has retained many of its 16th century religious buildings showing the fusion of local and European architectural styles.",[42]
Historic Inner City of Paramaribo,,"Paramaribo District, ?Suriname 5‹49Œ34N 55‹9Œ0W? / ?5.82611‹N 55.15000‹W","Cultural: (ii), (iv)",30 (74); buffer zone 60 (150),2002,"Founded as a Dutch colonial town in the 17th century, Paramaribo has preserved its unique street plan with buildings showing the gradual influence of Dutch architectural traditions.",[43]
Historic Quarter of the City of Colonia del Sacramento,,"Colonia Department, ?Uruguay 34‹28Œ4S 57‹51Œ12W? / ?34.46778‹S 57.85333‹W",Cultural: (iv),16 (40),1995,"Founded in 1680 by the Portuguese, the town changed hands between Spanish and Portuguese multiple times during the 17th and 18th centuries and was finally lost to the Spanish. Its well-preserved townscape bears testimony to the fusion of Spanish and Portuguese colonial styles.",[44]
Historic Quarter of the Seaport City of Valparaiso,,"Valparaiso Province, ?Chile 33‹2Œ26S 71‹37Œ41W? / ?33.04056‹S 71.62806‹W",Cultural: (iii),23 (57); buffer zone 45 (110),2003,In the late 19th century Valparaiso prospered as a stopover point for ships travelling between the Atlantic and Pacific via the Straits of Magellan. Its historic quarter set on steep hillsides has bears testimony to this early phase of globalization.,[45]
Historic Sanctuary of Machu Picchu,,"Cuzco, ?Peru 13‹7Œ0S 72‹35Œ0W? / ?13.11667‹S 72.58333‹W","Mixed: (i) (iii), (vii), (ix)","32,592 (80,540)",1983,"At 2,340 metres (7,680?ft) above sea level, the site of Machu Picchu was constructed as an expansive mountain estate around the middle of the 15th century, and abandoned approximately 100 years later. It includes walls, terraces, and buildings constructed from rock. The city was home to about 1,200 people, mostly priests, women, and children. It was left abandoned prior to the Spanish arrival in Cuzco most likely due to smallpox.",[46] [47]
Historic Town of Ouro Preto,,"Minas Gerais, ?Brazil 20‹23Œ20S 43‹30Œ20W? / ?20.38889‹S 43.50556‹W","Cultural: (i), (iii)",?,1980,"The prosperity of the town as the center of the Brazilian gold rush in the 18th century is reflected in a large number of preserved churches, bridges and fountains many of them designed by the Baroque sculptor Aleijadinho.",[48]
Huascaran National Park,,"Ancash, ?Peru 9‹20ŒS 77‹24ŒW? / ?9.333‹S 77.400‹W","Natural: (vii), (viii)","340,000 (840,000)",1985,"Huascaran National Park is located in the Cordillera Blanca mountain range of the Andes. It surrounds Huascaran, the tallest peak in Peru. The physical environment includes glaciers, ravines, and lakes, while the park is home to several regional animal species.",[49]
Humberstone and Santa Laura Saltpeter Worksõ,,"Tarapaca, ?Chile 20‹12Œ30S 69‹47Œ40W? / ?20.20833‹S 69.79444‹W","Cultural: (ii), (iii), (iv)",?,2005,"Situated in the Atacama Desert, the two saltpeter works are representative of the saltpeter industry that flourished in northern Chile in the 19th and early 20th century and brought together people from different parts of South America and Europe creating a unique culture with its own language and customs. The site has been listed as endangered since 2005 due to damage, vandalism, looting and the general fragile nature of the structures as a result of a 40 years' lack of maintenance.",[50][51]
Iguacu National Park,,"Parana, ?Brazil 25‹41ŒS 54‹26ŒW? / ?25.683‹S 54.433‹W","Natural: (vii), (x)","170,086 (420,290)",1986,"Together with Iguazu National Park on the Argentinian side, the park protects Iguazu Falls, one of the world's largest waterfalls, and is home to many rare and endangered species such as giant anteater or the giant otter. The site had been listed as endangered 1999?2001 due to an illegally opened road through the park, dams on the Iguazu River and helicopter flights.",[52]
Iguazu National Park,,"Misiones Province, Mesopotamia ?Argentina 25‹31Œ5S 54‹8Œ0W? / ?25.51806‹S 54.13333‹W","Natural: (vii), (x)","55,000 (140,000)",1984,"Together with Iguacu National Park on the Brazilian side, the park protects Iguazu Falls, one of the world's largest waterfalls. Its subtropical rainforest is home to more than 2000 species of vascular plants and large mammals such as tapirs, giant anteaters, howler monkeys, ocelots and jaguars.",[53]
Ischigualasto / Talampaya Natural Parks,,San Juan and La Rioja Province ?Argentina 30‹0ŒS 68‹0ŒW? / ?30.000‹S 68.000‹W,Natural: (viii),"275,369 (680,450)",2000,"As the most complete continental fossil site of the Triassic period (245?208 million years ago), the propertie's remains of mammals, dinosaurs and plants reveal the evolution of vertebrates.",[54]
Jesuit Block and Estancias of Cordoba,,Cordoba ?Argentina 31‹25Œ14S 64‹11Œ28W? / ?31.42056‹S 64.19111‹W,"Cultural: (ii), (iv)",?,2000,"Founded in the early 17th century, this Jesuit reduction has preserved the university, church, residences and five farming estates (estancias), illustrating the missionary and economic activities carried out by the Jesuits over a period of 150 years in the New World.",[55]
Jesuit Missions of La Santisima Trinidad de Parana and Jesus de Tavarangue,,Paraguay 27‹8ŒS 55‹42ŒW? / ?27.133‹S 55.700‹W,Cultural: (iv),?,1993,"The ruins of these Jesuit reductions bear testimony to the missionary, social and economical activities of the Jesuits in the Rio de la Plata Basin in the 17th and 18th centuries.",[56]
Jesuit Missions of Chiquitos,,"Santa Cruz Department, ?Bolivia 16‹0ŒS 60‹30ŒW? / ?16.000‹S 60.500‹W","Cultural: (iv), (v)",?,1990,Six settlements in the Chiquitania have been preserved as living heritage of their past as Jesuit reductions in the 17th and 18th centuries. Their churches largely restored in the late 20th century are a fusion of indigenous and European architectural traditions.,[57]
"Jesuit Missions of the Guaranis: San Ignacio Mini, Santa Ana, Nuestra Senora de Loreto and Santa Maria Mayor (Argentina), Ruins of Sao Miguel das Missoes (Brazil)",,"Misiones Province, ?Argentina* and Rio Grande do Sul, ?Brazil* 28‹32Œ36S 54‹15Œ57W? / ?28.54333‹S 54.26583‹W",Cultural: (iv),?,1983 [nb 5],Each of the five ruined Jesuit missions founded amidst a tropical forest in the land of the Guarani people in the 17th and 18th centuries is characterized by a specific design.,[58] [59]
Lines and Geoglyphs of Nazca and Pampas de Jumana,,"Nazca, ?Peru 14‹43Œ33S 75‹8Œ55W? / ?14.72583‹S 75.14861‹W","Cultural: (i), (iii), (iv)",?,1994,"The large designs in the Nazca Desert are believed to have been created by the Nazca culture between 400 and 650 AD. They were created by scratching lines into the ground surface. Designs include animals such as a monkey and hummingbird, plants, and geographic shapes on a large scale. It is believed that they served a ritualistic purpose.",[60] [61]
Los Alerces National Park,,"Chubut Province, ?Argentina 42‹51Œ10.08S 71‹52Œ22.085W? / ?42.8528000‹S 71.87280139‹W","Natural: (vii), (x)","188,379 (465,490); buffer zone 207,313 (512,280)",2017,,[62]
Los Glaciares National Park,,"Santa Cruz Province, ?Argentina 50‹0Œ0S 73‹14Œ58W? / ?50.00000‹S 73.24944‹W","Natural: (vii), (viii)","445,900 (1,102,000)",1981,"This National Park is of exceptional beauty comprising high peaks, glacial lakes and glaciers, some of which are advancing.",[63]
Los Katios National Park,,"Antioquia and Choco Departments, ?Colombia 7‹40ŒN 77‹0ŒW? / ?7.667‹N 77.000‹W","Natural: (ix), (x)","72,000 (180,000)",1994,"Situated at the Darien Gap, Los Katios comprizes hills, forests and humid plains that are notable for their exceptional bio-diversity including many endangered animal species and endemic plants. The site was listed as endangered from 2009 to 2015 due to deforestation, illegal fishing and hunting, but has now been removed from the endangered sites list.",[64][65]
Malpelo Fauna and Flora Sanctuary,,"Cauca Department, ?Colombia 3‹58ŒN 81‹37ŒW? / ?3.967‹N 81.617‹W","Natural: (vii), (ix)","857,500 (2,119,000)",2006,,[66]
Manu National Park,,"Madre de Dios, ?Peru 12‹15ŒS 71‹45ŒW? / ?12.250‹S 71.750‹W","Natural: (ix), (x)","1,716,295 (4,241,060)",1987 [nb 6],"The park spreads from 150 metres (490?ft) to 4,200 metres (13,800?ft) above sea-level. Manu is home to 1,000 bird species, over 200 species of mammals (100 of which are bats), and over 15,000 species of flowering plants. Prior to being recognized as a World Heritage site, it was designated as a biosphere reserve in 1977.",[67] [68] [69]
National Archeological Park of Tierradentro,,"Inza, Cauca Department, ?Colombia 2‹35Œ0N 76‹2Œ0W? / ?2.58333‹N 76.03333‹W",Cultural: (iii),?,1995,,[70]
Noel Kempff Mercado National Park,,"Santa Cruz Department, ?Bolivia 14‹16ŒS 60‹52ŒW? / ?14.267‹S 60.867‹W","Natural: (ix), (x)","1,523,446 (3,764,520)",2000,,[71]
Pampulha Modern Ensemble,,"Belo Horizonte, ?Brazil 19‹51Œ7S 43‹58Œ25W? / ?19.85194‹S 43.97361‹W","Cultural: (i), (ii), (iv)","154 (380); buffer zone 1,418 (3,500)",2016,,[72]
Pantanal Conservation Area,,"Mato Grosso do Sul and Mato Grosso, ?Brazil 17‹43ŒS 57‹23ŒW? / ?17.717‹S 57.383‹W","Natural: (vii), (ix), (x)","187,818 (464,110)",2000,,[73]
Peninsula Valdes,,Viedma Department ?Argentina 42‹30ŒS 64‹0ŒW? / ?42.500‹S 64.000‹W,Natural: (x),"360,000 (890,000)",1999,,[74]
"Port, Fortresses and Group of Monuments, Cartagena",,"Bolivar Department, ?Colombia 10‹25Œ0N 75‹32Œ0W? / ?10.41667‹N 75.53333‹W","Cultural: (iv), (vi)",?,1984,,[75]
Quebrada de Humahuaca,,Jujuy Province ?Argentina 23‹12Œ0S 65‹20Œ56W? / ?23.20000‹S 65.34889‹W,"Cultural: (ii), (iv), (v)","172,116 (425,310); buffer zone 369,649 (913,420)",2003,,[76]
"Qhapaq Nan, Andean Road System",,Argentina ?Bolivia ?Chile ?Colombia ?Ecuador ?Peru,"Cultural: (ii), (iii), (iv), (vi)","300,000,000 (740,000,000)",2014,"An extensive Inca communication, trade and defense network of roads covering 30,000?km (19,000?mi) and built over several centuries, this extraordinary network through one of the worldfs most extreme geographical terrains linked the snow-capped peaks of the Andes?at an altitude of more than 6,000?m (20,000?ft)?to the coast, running through hot rainforests, fertile valleys and absolute deserts.",[77]
Rio Abiseo National Park,?,"San Martin, ?Peru 7‹45ŒS 77‹15ŒW? / ?7.750‹S 77.250‹W","Mixed: (iii), (vii), (ix), (x)","274,520 (678,400)",1990 [nb 7],"The park was created in 1983 in order to protect the region's rainforest habitat. The park is home to many endemic species such as the yellow-tailed woolly monkey, which was thought to be extinct. The site is also listed under cultural criteria, as over 30 Pre-Columbian sites have been discovered since 1985.",[78] [79]
Rio de Janeiro: Carioca Landscapes Between the Mountain and the Sea,,"Rio de Janeiro, ?Brazil 24‹50ŒS 43‹11ŒW? / ?24.833‹S 43.183‹W",Cultural: (vi),"7,249 (17,910); buffer zone 8,621 (21,300)",2012,"The listed site consists of an exceptional urban setting rather than built heritage. It encompasses the key natural elements that have shaped and inspired the development of the city: from the highest points of the Tijuca National Parkfs mountains down to the sea. They also include the Botanical Gardens, established in 1808, Corcovado Mountain with its celebrated statue of Christ and the hills around Guanabara Bay, including the extensive designed landscapes along Copacabana Bay which have contributed to the outdoor living culture of this spectacular city. Rio de Janeiro is also recognized for the artistic inspiration it has provided to musicians, landscapers and urbanists.",[80]
Sacred City of Caral-Supe,,"Lima, ?Peru 10‹53Œ30S 77‹31Œ17W? / ?10.89167‹S 77.52139‹W","Cultural: (ii), (iii), (iv)","626 (1,550); buffer zone 14,620 (36,100)",2009,The archaeological site belonged to the Norte Chico civilization that inhabited the area during the Late Archaic period. Caral is one of 18 complex urban settlements in the region and features many monuments and pyramids. Caral is the earliest known American settlement. A quipu recovered from the site demonstrates its influence on later Andean cultures.,[81]
San Agustin Archaeological Park,,"San Augustin and San Jose de Isnos, Huila Department, ?Colombia 1‹55Œ0N 76‹14Œ0W? / ?1.91667‹N 76.23333‹W",Cultural: (iii),?,1995,,[82]
Sanctuary of Bom Jesus do Congonhas,,"Congonhas, Minas Gerais, ?Brazil 20‹29Œ59S 43‹51Œ28W? / ?20.49972‹S 43.85778‹W","Cultural: (i), (iv)",?,1985,,[83]
Sangay National Park,,"Morona Santiago, Chimborazo and Tungurahua Provinces, ?Ecuador 1‹50ŒS 78‹20ŒW? / ?1.833‹S 78.333‹W","Natural: (vii), (viii), (ix), (x)","271,925 (671,940)",1983,Endangered 1992?2005,[84]
Sao Francisco Square in the Town of Sao Cristovao,,"Sao Cristovao, Sergipe, ?Brazil 11‹0Œ58S 37‹12Œ36W? / ?11.01611‹S 37.21000‹W","Cultural: (ii), (iv)","3.00 (7.4); buffer zone 2,500 (6,200)",2010,,[85]
Serra da Capivara National Park,,"Piaui, ?Brazil 8‹25Œ0S 42‹20Œ0W? / ?8.41667‹S 42.33333‹W",Cultural: (iii),?,1991,,[86]
Sewell Mining Town,,"Machali, Cachapoal Province, O'Higgins Region ?Chile 34‹5Œ4S 70‹22Œ58W? / ?34.08444‹S 70.38278‹W",Cultural: (ii),17 (42); buffer zone 33 (82),2006,,[87]
Tiwanaku: Spiritual and Political Centre of the Tiwanaku Culture,,"Ingavi Province, La Paz Department, ?Bolivia 16‹33Œ30S 68‹40Œ40W? / ?16.55833‹S 68.67778‹W","Cultural: (iii), (iv)",?,2000,,[88]
Valongo Wharf Archaeological Site,,"Rio de Janeiro, ?Brazil 22‹53Œ49.6S 43‹11Œ14.62W? / ?22.897111‹S 43.1873944‹W",Cultural: (vi),0.39 (0.96); buffer zone 42 (100),2017,,[89]
Central Sikhote-Alin,,"Primorsky Krai, ?Russia 45‹20ŒN 136‹10ŒE? / ?45.333‹N 136.167‹E",Natural: (x),"1,553,928 (3,839,840); buffer zone 65,250 (161,200)",2001,,[8]
Golden Mountains of Altai,,"Altai Republic, ?Russia 50‹28ŒN 86‹0ŒE? / ?50.467‹N 86.000‹E",Natural: (x),"1,611,457 (3,982,000)",1998,,[9]
Historic Centre of Bukhara,,"Bukhara Province, ?Uzbekistan 39‹46Œ29N 64‹25Œ43E? / ?39.77472‹N 64.42861‹E","Cultural: (ii), (iv), (vi)",?,1993,,[10]
Historic Centre of Shakhrisyabz,,"Qashqadaryo Province, ?Uzbekistan 39‹3Œ0N 66‹50Œ0E? / ?39.05000‹N 66.83333‹E","Cultural: (iii), (iv)",240 (590); buffer zone 82 (200),2000,,[11]
Itchan Kala,,"Khiva, Xorazm Province, ?Uzbekistan 41‹22Œ42N 60‹21Œ50E? / ?41.37833‹N 60.36389‹E","Cultural: (iii), (iv), (v)",26 (64),1990,,[12]
Kunya-Urgench,,"Da?oguz Province, ?Turkmenistan 42‹10Œ59N 59‹5Œ6E? / ?42.18306‹N 59.08500‹E","Cultural: (ii), (iii)",?,2005,,[13]
Lake Baikal,,"Irkutsk Oblast and Republic of Buryatia, ?Russia 53‹10Œ25N 107‹39Œ45E? / ?53.17361‹N 107.66250‹E","Natural: (vii), (viii), (ix), (x)","8,800,000 (22,000,000)",1996,,[14]
Lena Pillars Nature Park,,"Sakha Republic, ?Russia 60‹40Œ0N 127‹0Œ0E? / ?60.66667‹N 127.00000‹E",Natural: (viii),"1,272,150 (3,143,600)",2012,,[15]
Mausoleum of Khoja Ahmed Yasawi,,"Turkestan, South Kazakhstan Province, ?Kazakhstan 43‹17Œ35N 68‹16Œ28E? / ?43.29306‹N 68.27444‹E","Cultural: (i), (iii), (iv)",0.55 (1.4); buffer zone 88 (220),2003,,[16]
Natural System of Wrangel Island Reserve,,"Chukotka Autonomous Okrug, ?Russia 71‹11Œ20N 179‹42Œ55E? / ?71.18889‹N 179.71528‹E","Natural: (ix), (x)","916,300 (2,264,000); buffer zone 3,745,300 (9,255,000)",2004,,[17]
Parthian Fortresses of Nisa,,"Bagyr settlement, Ruhabat District, Ahal Province, ?Turkmenistan 37‹59Œ59N 58‹11Œ55E? / ?37.99972‹N 58.19861‹E","Cultural: (ii), (iii)",78 (190); buffer zone 400 (990),2007,,[18]
Petroglyphs within the Archaeological Landscape of Tamgaly,,"Almaty Province, ?Kazakhstan 43‹48Œ12N 75‹32Œ6E? / ?43.80333‹N 75.53500‹E",Cultural: (iii),"900 (2,200); buffer zone 2,900 (7,200)",2004,,[19]
Proto-urban site of Sarazm,?,"Panjakent, ?Tajikistan 39‹30Œ28N 67‹27Œ37E? / ?39.50778‹N 67.46028‹E","Cultural: (ii), (iii)",16 (40); buffer zone 142 (350),2010,,[20]
Putorana Plateau,,"Krasnoyarsk Krai, ?Russia 69‹2Œ49N 94‹9Œ29E? / ?69.04694‹N 94.15806‹E","Natural: (vii), (ix)","1,887,251 (4,663,500); buffer zone 1,773,300 (4,382,000)",2010,,[21]
Samarkand ? Crossroads of Cultures,,"Samarqand Province, ?Uzbekistan 39‹40Œ7N 67‹0Œ0E? / ?39.66861‹N 67.00000‹E","Cultural: (i), (ii), (iv)","965 (2,380)",2001,,[22]
Saryarka ? Steppe and Lakes of Northern Kazakhstan,,"Akmola and Kostanay Provinces, ?Kazakhstan 50‹26ŒN 69‹11ŒE? / ?50.433‹N 69.183‹E","Natural: (ix), (x)","450,344 (1,112,820); buffer zone 211,148 (521,760)",2008,,[23]
Silk Roads: the Routes Network of Chang'an-Tianshan Corridor,,"22 sites in ?China: Luoyang, Lingbao and Xin'an of Henan Province; Xi'an, Bin County and Chenggu of Shaanxi Province; Tianshui, Yongjing, Dunhuang and Anxi of Gansu Province; Turpan, Jimsar and Kuqa of Xinjiang Uyghur Autonomous Region. 8 sites in ?Kazakhstan: Almaty Province and Jambyl Province. 3 sites in ?Kyrgyzstan: Chuy Province",Cultural: (ii)(iii)(iv)(vi),"42,668.16 (105,435.3); buffer zone 189,963.13 (469,409.1)",2014,,[24]
State Historical and Cultural Park gAncient Mervh,,"Mary Province, ?Turkmenistan 37‹42Œ3N 62‹10Œ39E? / ?37.70083‹N 62.17750‹E","Cultural: (ii), (iii)","353 (870); buffer zone 883 (2,180)",1999,,[25]
Sulaiman-Too Sacred Mountain,,"Osh, ?Kyrgyzstan 40‹31Œ52N 72‹46Œ58E? / ?40.53111‹N 72.78278‹E","Cultural: (iii), (vi)","112 (280); buffer zone 4,788 (11,830)",2009,,[26]
Tajik National Park (Mountains of the Pamirs),,Tajikistan 38‹45Œ54N 72‹18Œ19E? / ?38.76500‹N 72.30528‹E,"Natural: (vii), (viii)","2,611,674 (6,453,590)",2013,,[27]
Uvs Nuur Basin,,"Uvs, Zavkhan and Khovsgol Provinces ?Mongolia*; Mongun-Tayginsky, Ovyursky, Tes-Khemsky and Erzinsky Districts, Tuva Republic, ?Russia* 50‹16Œ30N 92‹43Œ1E? / ?50.27500‹N 92.71694‹E","Natural: (ix), (x)","898,064 (2,219,160); buffer zone 170,790 (422,000)",2003,,[28]
Volcanoes of Kamchatka,,"Kamchatka Krai, ?Russia 56‹20ŒN 158‹30ŒE? / ?56.333‹N 158.500‹E","Natural: (vii), (viii), (ix), (x)","3,830,200 (9,465,000)",1996[nb 1],,[29][30]
Aflaj Irrigation Systems of Oman,,"Sharqiyah and Batinah Regions, ?Oman 22‹59Œ56N 57‹32Œ10E? / ?22.99889‹N 57.53611‹E",Cultural: (v),"1,456 (3,600); buffer zone 16,404 (40,540)",2006,,[9]
Al-Hijr Archaeological Site (Madain Salih),,"Al Madinah Province, ?Saudi Arabia 26‹47Œ1N 37‹57Œ18E? / ?26.78361‹N 37.95500‹E",Cultural: (ii)(iii),"1,621 (4,010); buffer zone 1,659 (4,100)",2008,,[10]
Al Zubarah Archaeological Site,,"Madinat ash Shamal, ?Qatar 25‹58Œ41N 51‹1Œ47E? / ?25.97806‹N 51.02972‹E",Cultural: (iii)(iv)(v),"416 (1,030); buffer zone 7,196 (17,780)",2013,,[11]
Ancient City of Aleppo,,"Aleppo Governorate, ?Syria 36‹14Œ0N 37‹10Œ0E? / ?36.23333‹N 37.16667‹E",Cultural: (iii)(iv),350 (860),1986,,[12]
Ancient City of Bosra,,"Daraa Governorate, ?Syria 32‹31Œ5N 36‹28Œ54E? / ?32.51806‹N 36.48167‹E",Cultural: (i)(iii)(vi),?,1980,,[13]
Ancient City of Damascus,,"Damascus Governorate, ?Syria 33‹30Œ41N 36‹18Œ23E? / ?33.51139‹N 36.30639‹E",Cultural: (i)(ii)(iii)(iv)(vi),86 (210),1979,,[14]
Ancient Villages of Northern Syria,,Syria 36‹20Œ3N 36‹50Œ39E? / ?36.33417‹N 36.84417‹E,Cultural: (iii)(iv)(v),"12,290 (30,400)",2011,,[15]
Anjar,,"Beqaa Governorate, ?Lebanon 33‹43Œ33N 35‹55Œ47E? / ?33.72583‹N 35.92972‹E",Cultural: (iii)(iv),?,1984,,[16]
Archaeological Site of Troy,,"Canakkale Province, ?Turkey 39‹57Œ23N 26‹14Œ20E? / ?39.95639‹N 26.23889‹E",Cultural: (ii)(iii)(vi),158 (390),1998,,[17]
"Archaeological Sites of Bat, Al-Khutm and Al-Ayn",,"Ad Dhahirah Region, ?Oman 23‹16Œ11N 56‹44Œ42E? / ?23.26972‹N 56.74500‹E",Cultural: (iii)(iv),?,1988,,[18]
Armenian Monastic Ensembles of Iran,,"West Azerbaijan, ?Iran 38‹58Œ44N 45‹28Œ24E? / ?38.97889‹N 45.47333‹E",Cultural: (ii)(iii)(vi),"129 (320); buffer zone 655 (1,620)",2008,"including: St Thaddeus Monastery, St Stepanos Monastery, Chapel of Dzordzor, Chapel of Chupan, Church of the Holy Mother of God",[19]
Ashur (Qal'at Sherqat),,"Salah ad Din Governorate, ?Iraq 35‹27Œ32N 43‹15Œ35E? / ?35.45889‹N 43.25972‹E",Cultural: (iii)(iv),70 (170); buffer zone 100 (250),2003,,[20] [21]
At-Turaif District in ad-Dir'iyah,,"Riyadh Province, ?Saudi Arabia 24‹44Œ3N 46‹34Œ21E? / ?24.73417‹N 46.57250‹E",Cultural: (ii)(iii),29 (72),2008,,[22]
Baalbek,,"Beqaa Governorate, ?Lebanon 34‹0Œ25N 36‹12Œ18E? / ?34.00694‹N 36.20500‹E",Cultural: (i)(iv),?,1984,,[23]
Bahafi Holy Places in Haifa and the Western Galilee,,"Haifa and North District, ?Israel 32‹49Œ46N 34‹58Œ18E? / ?32.82944‹N 34.97167‹E",Cultural: (iii)(vi),63 (160); buffer zone 255 (630),2008,,[24]
Bahla Fort,,"Ad Dakhiliyah Region, ?Oman 22‹57Œ51N 57‹18Œ4E? / ?22.96417‹N 57.30111‹E",Cultural: (iv),?,1987,,[25]
Bam and its Cultural Landscape,,"Kerman, ?Iran 29‹07Œ00.68N 58‹22Œ06.51E? / ?29.1168556‹N 58.3684750‹E",Cultural: (ii)(iii)(iv)(v),?,2004,,[26]
Baptism Site gBethany Beyond the Jordanh (Al-Maghtas),,"Jordan River, ?Jordan 31‹50Œ13N 35‹32Œ50E? / ?31.83694‹N 35.54722‹E",Cultural: (iii)(vi),"294 (730); buffer zone 957 (2,360)",2015,,[27]
"Biblical tells - Megiddo, Hazor, Beer Sheba",,Israel 32‹35Œ50N 35‹10Œ56E? / ?32.59722‹N 35.18222‹E,Cultural: (ii)(iii)(iv)(vi),"96 (240); buffer zone 604 (1,490)",2005,,[28]
Bisotun,,"Kermanshah, ?Iran 34‹23Œ18N 47‹26Œ12E? / ?34.38833‹N 47.43667‹E",Cultural: (ii)(iii),187 (460); buffer zone 361 (890),2006,,[29]
Bursa and Cumal?k?z?k: the Birth of the Ottoman Empire,,"City of Bursa and village of Cumal?k?z?k, Bursa Province, ?Turkey 40‹11Œ5N 29‹3Œ44E? / ?40.18472‹N 29.06222‹E",Cultural: (i)(ii)(iii)(iv)(vi),193 (480),2014,,[30]
Byblos,,"Mount Lebanon Governorate, ?Lebanon 34‹7Œ9N 35‹38Œ51E? / ?34.11917‹N 35.64750‹E",Cultural: (iii)(iv)(vi),?,1984,,[31]
Caves of Maresha and Bet-Guvrin in the Judean Lowlands as a Microcosm of the Land of the Caves,,"Southern District, ?Israel 31‹36Œ0N 34‹53Œ44E? / ?31.60000‹N 34.89556‹E",Cultural: (V),259 (640),2014,,[32]
Cathedral and Churches of Echmiatsin and the Archaeological Site of Zvartnots,,"Armavir Province, ?Armenia 40‹9Œ34N 44‹17Œ43E? / ?40.15944‹N 44.29528‹E",Cultural: (ii)(iii),74 (180),2000,,[33]
Choirokoitia,,"Larnaca District, ?Cyprus 34‹47Œ54N 33‹20Œ36E? / ?34.79833‹N 33.34333‹E",Cultural: (ii)(iii)(iv),?,1998,,[34]
"Birthplace of Jesus: Church of the Nativity and the Pilgrimage Route, Bethlehem",,"Bethlehem Governorate, ?Palestine 31‹42Œ16N 35‹12Œ28E? / ?31.70444‹N 35.20778‹E","Cultural: (iv), (vi)",2.98 (7.4),2012,,[35][36]
Erbil Citadel,,"Iraqi Kurdistan,?Iraq 36‹11Œ28N 44‹0Œ33E? / ?36.19111‹N 44.00917‹E",Cultural: (iv),16 (40); buffer zone 268 (660),2014,,[37]
City of Safranbolu,,"City and district of Safranbolu, Karabuk Province, ?Turkey 41‹15Œ36N 32‹41Œ23E? / ?41.26000‹N 32.68972‹E",Cultural: (ii)(iv)(v),193 (480),1994,,[38]
Crac des Chevaliers and Qalfat Salah El-Din,,"Homs and Latakia Governorates, ?Syria 34‹46Œ54N 36‹15Œ47E? / ?34.78167‹N 36.26306‹E",Cultural: (ii)(iv),9 (22),2006,,[39]
"Cultural Sites of Al Ain (Hafit, Hili, Bidaa Bint Saud and Oases Areas)",,United Arab Emirates 24‹4Œ4N 55‹48Œ23E? / ?24.06778‹N 55.80639‹E,Cultural: (iii)(iv)(v),"4,945 (12,220); buffer zone 7,605 (18,790)",2011,,[40]
Gelati Monastery,,"Imereti, ?Georgia 42‹17Œ41N 42‹46Œ6E? / ?42.29472‹N 42.76833‹E",Cultural: (iv),"4.2 (10); buffer zone 1,246 (3,080)",1994[nb 2],,[41]
Gobustan Rock Art Cultural Landscape,,"Garadagh and Absheron districts, ?Azerbaijan 40‹7Œ30N 49‹22Œ30E? / ?40.12500‹N 49.37500‹E",Cultural: (iii),"537 (1,330); buffer zone 3,096 (7,650)",2007,,[42]
Golestan Palace,,"Tehran, ?Iran 35‹40Œ49N 51‹25Œ14E? / ?35.68028‹N 51.42056‹E",Cultural: (i)(ii)(iii)(iv),5.3 (13); buffer zone 26 (64),2013,,[43]
Gonbad-e Qabus,,"Golestan, ?Iran 37‹15Œ29N 55‹10Œ8E? / ?37.25806‹N 55.16889‹E",Cultural: (i)(ii)(iii)(iv),1.48 (3.7); buffer zone 18 (44),2012,,[44]
Great Mosque and Hospital of Divri?i,,"city and district of Divri?i, Sivas Province, ?Turkey 39‹22Œ25N 38‹7Œ25E? / ?39.37361‹N 38.12361‹E",Cultural: (i)(iv),"2,016 (4,980)",1985,,[45]
